No.     Time           Source                Destination           Protocol Length Info
  19937 227.612069     192.168.3.103         34.49.233.224         TCP      66     54396 → 443 [SYN] Seq=0 Win=64240 Len=0 MSS=1460 WS=256 SACK_PERM

Frame 19937: 66 bytes on wire (528 bits), 66 bytes captured (528 bits) on interface \Device\NPF_{FF4772B8-9159-442F-8EE1-63F8B1A5EF2A}, id 0
Ethernet II, Src: Intel_25:d9:6f (c8:f7:33:25:d9:6f), Dst: TendaTechnol_8d:1d:b0 (58:d9:d5:8d:1d:b0)
Internet Protocol Version 4, Src: 192.168.3.103, Dst: 34.49.233.224
Transmission Control Protocol, Src Port: 54396, Dst Port: 443, Seq: 0, Len: 0

No.     Time           Source                Destination           Protocol Length Info
  19938 227.613042     192.168.3.103         34.49.233.224         TCP      66     54397 → 443 [SYN] Seq=0 Win=64240 Len=0 MSS=1460 WS=256 SACK_PERM

Frame 19938: 66 bytes on wire (528 bits), 66 bytes captured (528 bits) on interface \Device\NPF_{FF4772B8-9159-442F-8EE1-63F8B1A5EF2A}, id 0
Ethernet II, Src: Intel_25:d9:6f (c8:f7:33:25:d9:6f), Dst: TendaTechnol_8d:1d:b0 (58:d9:d5:8d:1d:b0)
Internet Protocol Version 4, Src: 192.168.3.103, Dst: 34.49.233.224
Transmission Control Protocol, Src Port: 54397, Dst Port: 443, Seq: 0, Len: 0

No.     Time           Source                Destination           Protocol Length Info
  19939 227.628317     34.49.233.224         192.168.3.103         TCP      66     443 → 54396 [SYN, ACK] Seq=0 Ack=1 Win=65535 Len=0 MSS=1412 SACK_PERM WS=256

Frame 19939: 66 bytes on wire (528 bits), 66 bytes captured (528 bits) on interface \Device\NPF_{FF4772B8-9159-442F-8EE1-63F8B1A5EF2A}, id 0
Ethernet II, Src: TendaTechnol_8d:1d:b0 (58:d9:d5:8d:1d:b0), Dst: Intel_25:d9:6f (c8:f7:33:25:d9:6f)
Internet Protocol Version 4, Src: 34.49.233.224, Dst: 192.168.3.103
Transmission Control Protocol, Src Port: 443, Dst Port: 54396, Seq: 0, Ack: 1, Len: 0

No.     Time           Source                Destination           Protocol Length Info
  19940 227.628471     192.168.3.103         34.49.233.224         TCP      54     54396 → 443 [ACK] Seq=1 Ack=1 Win=131072 Len=0

Frame 19940: 54 bytes on wire (432 bits), 54 bytes captured (432 bits) on interface \Device\NPF_{FF4772B8-9159-442F-8EE1-63F8B1A5EF2A}, id 0
Ethernet II, Src: Intel_25:d9:6f (c8:f7:33:25:d9:6f), Dst: TendaTechnol_8d:1d:b0 (58:d9:d5:8d:1d:b0)
Internet Protocol Version 4, Src: 192.168.3.103, Dst: 34.49.233.224
Transmission Control Protocol, Src Port: 54396, Dst Port: 443, Seq: 1, Ack: 1, Len: 0

No.     Time           Source                Destination           Protocol Length Info
  19941 227.629155     34.49.233.224         192.168.3.103         TCP      66     443 → 54397 [SYN, ACK] Seq=0 Ack=1 Win=65535 Len=0 MSS=1412 SACK_PERM WS=256

Frame 19941: 66 bytes on wire (528 bits), 66 bytes captured (528 bits) on interface \Device\NPF_{FF4772B8-9159-442F-8EE1-63F8B1A5EF2A}, id 0
Ethernet II, Src: TendaTechnol_8d:1d:b0 (58:d9:d5:8d:1d:b0), Dst: Intel_25:d9:6f (c8:f7:33:25:d9:6f)
Internet Protocol Version 4, Src: 34.49.233.224, Dst: 192.168.3.103
Transmission Control Protocol, Src Port: 443, Dst Port: 54397, Seq: 0, Ack: 1, Len: 0

No.     Time           Source                Destination           Protocol Length Info
  19942 227.629256     192.168.3.103         34.49.233.224         TCP      54     54397 → 443 [ACK] Seq=1 Ack=1 Win=131072 Len=0

Frame 19942: 54 bytes on wire (432 bits), 54 bytes captured (432 bits) on interface \Device\NPF_{FF4772B8-9159-442F-8EE1-63F8B1A5EF2A}, id 0
Ethernet II, Src: Intel_25:d9:6f (c8:f7:33:25:d9:6f), Dst: TendaTechnol_8d:1d:b0 (58:d9:d5:8d:1d:b0)
Internet Protocol Version 4, Src: 192.168.3.103, Dst: 34.49.233.224
Transmission Control Protocol, Src Port: 54397, Dst Port: 443, Seq: 1, Ack: 1, Len: 0

No.     Time           Source                Destination           Protocol Length Info
  19943 227.629627     192.168.3.103         34.49.233.224         TCP      1466   54396 → 443 [ACK] Seq=1 Ack=1 Win=131072 Len=1412 [TCP PDU reassembled in 19944]

Frame 19943: 1466 bytes on wire (11728 bits), 1466 bytes captured (11728 bits) on interface \Device\NPF_{FF4772B8-9159-442F-8EE1-63F8B1A5EF2A}, id 0
Ethernet II, Src: Intel_25:d9:6f (c8:f7:33:25:d9:6f), Dst: TendaTechnol_8d:1d:b0 (58:d9:d5:8d:1d:b0)
Internet Protocol Version 4, Src: 192.168.3.103, Dst: 34.49.233.224
Transmission Control Protocol, Src Port: 54396, Dst Port: 443, Seq: 1, Ack: 1, Len: 1412

No.     Time           Source                Destination           Protocol Length Info
  19944 227.629627     192.168.3.103         34.49.233.224         TLSv1.3  401    Client Hello (SNI=geeksforgeeks.org)

Frame 19944: 401 bytes on wire (3208 bits), 401 bytes captured (3208 bits) on interface \Device\NPF_{FF4772B8-9159-442F-8EE1-63F8B1A5EF2A}, id 0
Ethernet II, Src: Intel_25:d9:6f (c8:f7:33:25:d9:6f), Dst: TendaTechnol_8d:1d:b0 (58:d9:d5:8d:1d:b0)
Internet Protocol Version 4, Src: 192.168.3.103, Dst: 34.49.233.224
Transmission Control Protocol, Src Port: 54396, Dst Port: 443, Seq: 1413, Ack: 1, Len: 347
[2 Reassembled TCP Segments (1759 bytes): #19943(1412), #19944(347)]
Transport Layer Security

No.     Time           Source                Destination           Protocol Length Info
  19945 227.631337     192.168.3.103         34.49.233.224         TCP      1466   54397 → 443 [ACK] Seq=1 Ack=1 Win=131072 Len=1412 [TCP PDU reassembled in 19946]

Frame 19945: 1466 bytes on wire (11728 bits), 1466 bytes captured (11728 bits) on interface \Device\NPF_{FF4772B8-9159-442F-8EE1-63F8B1A5EF2A}, id 0
Ethernet II, Src: Intel_25:d9:6f (c8:f7:33:25:d9:6f), Dst: TendaTechnol_8d:1d:b0 (58:d9:d5:8d:1d:b0)
Internet Protocol Version 4, Src: 192.168.3.103, Dst: 34.49.233.224
Transmission Control Protocol, Src Port: 54397, Dst Port: 443, Seq: 1, Ack: 1, Len: 1412

No.     Time           Source                Destination           Protocol Length Info
  19946 227.631337     192.168.3.103         34.49.233.224         TLSv1.3  369    Client Hello (SNI=geeksforgeeks.org)

Frame 19946: 369 bytes on wire (2952 bits), 369 bytes captured (2952 bits) on interface \Device\NPF_{FF4772B8-9159-442F-8EE1-63F8B1A5EF2A}, id 0
Ethernet II, Src: Intel_25:d9:6f (c8:f7:33:25:d9:6f), Dst: TendaTechnol_8d:1d:b0 (58:d9:d5:8d:1d:b0)
Internet Protocol Version 4, Src: 192.168.3.103, Dst: 34.49.233.224
Transmission Control Protocol, Src Port: 54397, Dst Port: 443, Seq: 1413, Ack: 1, Len: 315
[2 Reassembled TCP Segments (1727 bytes): #19945(1412), #19946(315)]
Transport Layer Security

No.     Time           Source                Destination           Protocol Length Info
  19947 227.649883     34.49.233.224         192.168.3.103         TCP      66     [TCP Dup ACK 19939#1] 443 → 54396 [ACK] Seq=1 Ack=1 Win=269824 Len=0 SLE=1413 SRE=1760

Frame 19947: 66 bytes on wire (528 bits), 66 bytes captured (528 bits) on interface \Device\NPF_{FF4772B8-9159-442F-8EE1-63F8B1A5EF2A}, id 0
Ethernet II, Src: TendaTechnol_8d:1d:b0 (58:d9:d5:8d:1d:b0), Dst: Intel_25:d9:6f (c8:f7:33:25:d9:6f)
Internet Protocol Version 4, Src: 34.49.233.224, Dst: 192.168.3.103
Transmission Control Protocol, Src Port: 443, Dst Port: 54396, Seq: 1, Ack: 1, Len: 0

No.     Time           Source                Destination           Protocol Length Info
  19948 227.649883     34.49.233.224         192.168.3.103         TCP      54     443 → 54396 [ACK] Seq=1 Ack=1760 Win=268288 Len=0

Frame 19948: 54 bytes on wire (432 bits), 54 bytes captured (432 bits) on interface \Device\NPF_{FF4772B8-9159-442F-8EE1-63F8B1A5EF2A}, id 0
Ethernet II, Src: TendaTechnol_8d:1d:b0 (58:d9:d5:8d:1d:b0), Dst: Intel_25:d9:6f (c8:f7:33:25:d9:6f)
Internet Protocol Version 4, Src: 34.49.233.224, Dst: 192.168.3.103
Transmission Control Protocol, Src Port: 443, Dst Port: 54396, Seq: 1, Ack: 1760, Len: 0

No.     Time           Source                Destination           Protocol Length Info
  19949 227.649883     34.49.233.224         192.168.3.103         TCP      66     [TCP Dup ACK 19941#1] 443 → 54397 [ACK] Seq=1 Ack=1 Win=269824 Len=0 SLE=1413 SRE=1728

Frame 19949: 66 bytes on wire (528 bits), 66 bytes captured (528 bits) on interface \Device\NPF_{FF4772B8-9159-442F-8EE1-63F8B1A5EF2A}, id 0
Ethernet II, Src: TendaTechnol_8d:1d:b0 (58:d9:d5:8d:1d:b0), Dst: Intel_25:d9:6f (c8:f7:33:25:d9:6f)
Internet Protocol Version 4, Src: 34.49.233.224, Dst: 192.168.3.103
Transmission Control Protocol, Src Port: 443, Dst Port: 54397, Seq: 1, Ack: 1, Len: 0

No.     Time           Source                Destination           Protocol Length Info
  19950 227.649883     34.49.233.224         192.168.3.103         TCP      54     443 → 54397 [ACK] Seq=1 Ack=1728 Win=268288 Len=0

Frame 19950: 54 bytes on wire (432 bits), 54 bytes captured (432 bits) on interface \Device\NPF_{FF4772B8-9159-442F-8EE1-63F8B1A5EF2A}, id 0
Ethernet II, Src: TendaTechnol_8d:1d:b0 (58:d9:d5:8d:1d:b0), Dst: Intel_25:d9:6f (c8:f7:33:25:d9:6f)
Internet Protocol Version 4, Src: 34.49.233.224, Dst: 192.168.3.103
Transmission Control Protocol, Src Port: 443, Dst Port: 54397, Seq: 1, Ack: 1728, Len: 0

No.     Time           Source                Destination           Protocol Length Info
  19951 227.650148     34.49.233.224         192.168.3.103         TLSv1.3  1466   Server Hello, Change Cipher Spec

Frame 19951: 1466 bytes on wire (11728 bits), 1466 bytes captured (11728 bits) on interface \Device\NPF_{FF4772B8-9159-442F-8EE1-63F8B1A5EF2A}, id 0
Ethernet II, Src: TendaTechnol_8d:1d:b0 (58:d9:d5:8d:1d:b0), Dst: Intel_25:d9:6f (c8:f7:33:25:d9:6f)
Internet Protocol Version 4, Src: 34.49.233.224, Dst: 192.168.3.103
Transmission Control Protocol, Src Port: 443, Dst Port: 54396, Seq: 1, Ack: 1760, Len: 1412
Transport Layer Security

No.     Time           Source                Destination           Protocol Length Info
  19952 227.650482     34.49.233.224         192.168.3.103         TCP      1466   443 → 54396 [PSH, ACK] Seq=1413 Ack=1760 Win=268288 Len=1412 [TCP PDU reassembled in 19955]

Frame 19952: 1466 bytes on wire (11728 bits), 1466 bytes captured (11728 bits) on interface \Device\NPF_{FF4772B8-9159-442F-8EE1-63F8B1A5EF2A}, id 0
Ethernet II, Src: TendaTechnol_8d:1d:b0 (58:d9:d5:8d:1d:b0), Dst: Intel_25:d9:6f (c8:f7:33:25:d9:6f)
Internet Protocol Version 4, Src: 34.49.233.224, Dst: 192.168.3.103
Transmission Control Protocol, Src Port: 443, Dst Port: 54396, Seq: 1413, Ack: 1760, Len: 1412

No.     Time           Source                Destination           Protocol Length Info
  19953 227.650546     192.168.3.103         34.49.233.224         TCP      54     54396 → 443 [ACK] Seq=1760 Ack=2825 Win=131072 Len=0

Frame 19953: 54 bytes on wire (432 bits), 54 bytes captured (432 bits) on interface \Device\NPF_{FF4772B8-9159-442F-8EE1-63F8B1A5EF2A}, id 0
Ethernet II, Src: Intel_25:d9:6f (c8:f7:33:25:d9:6f), Dst: TendaTechnol_8d:1d:b0 (58:d9:d5:8d:1d:b0)
Internet Protocol Version 4, Src: 192.168.3.103, Dst: 34.49.233.224
Transmission Control Protocol, Src Port: 54396, Dst Port: 443, Seq: 1760, Ack: 2825, Len: 0

No.     Time           Source                Destination           Protocol Length Info
  19954 227.650873     34.49.233.224         192.168.3.103         TCP      1466   443 → 54396 [ACK] Seq=2825 Ack=1760 Win=268288 Len=1412 [TCP PDU reassembled in 19955]

Frame 19954: 1466 bytes on wire (11728 bits), 1466 bytes captured (11728 bits) on interface \Device\NPF_{FF4772B8-9159-442F-8EE1-63F8B1A5EF2A}, id 0
Ethernet II, Src: TendaTechnol_8d:1d:b0 (58:d9:d5:8d:1d:b0), Dst: Intel_25:d9:6f (c8:f7:33:25:d9:6f)
Internet Protocol Version 4, Src: 34.49.233.224, Dst: 192.168.3.103
Transmission Control Protocol, Src Port: 443, Dst Port: 54396, Seq: 2825, Ack: 1760, Len: 1412

No.     Time           Source                Destination           Protocol Length Info
  19955 227.651107     34.49.233.224         192.168.3.103         TLSv1.3  1434   Application Data

Frame 19955: 1434 bytes on wire (11472 bits), 1434 bytes captured (11472 bits) on interface \Device\NPF_{FF4772B8-9159-442F-8EE1-63F8B1A5EF2A}, id 0
Ethernet II, Src: TendaTechnol_8d:1d:b0 (58:d9:d5:8d:1d:b0), Dst: Intel_25:d9:6f (c8:f7:33:25:d9:6f)
Internet Protocol Version 4, Src: 34.49.233.224, Dst: 192.168.3.103
Transmission Control Protocol, Src Port: 443, Dst Port: 54396, Seq: 4237, Ack: 1760, Len: 1380
[4 Reassembled TCP Segments (5483 bytes): #19951(1279), #19952(1412), #19954(1412), #19955(1380)]
Transport Layer Security

No.     Time           Source                Destination           Protocol Length Info
  19956 227.651196     192.168.3.103         34.49.233.224         TCP      54     54396 → 443 [ACK] Seq=1760 Ack=5617 Win=131072 Len=0

Frame 19956: 54 bytes on wire (432 bits), 54 bytes captured (432 bits) on interface \Device\NPF_{FF4772B8-9159-442F-8EE1-63F8B1A5EF2A}, id 0
Ethernet II, Src: Intel_25:d9:6f (c8:f7:33:25:d9:6f), Dst: TendaTechnol_8d:1d:b0 (58:d9:d5:8d:1d:b0)
Internet Protocol Version 4, Src: 192.168.3.103, Dst: 34.49.233.224
Transmission Control Protocol, Src Port: 54396, Dst Port: 443, Seq: 1760, Ack: 5617, Len: 0

No.     Time           Source                Destination           Protocol Length Info
  19957 227.652799     34.49.233.224         192.168.3.103         TLSv1.3  1466   Server Hello, Change Cipher Spec

Frame 19957: 1466 bytes on wire (11728 bits), 1466 bytes captured (11728 bits) on interface \Device\NPF_{FF4772B8-9159-442F-8EE1-63F8B1A5EF2A}, id 0
Ethernet II, Src: TendaTechnol_8d:1d:b0 (58:d9:d5:8d:1d:b0), Dst: Intel_25:d9:6f (c8:f7:33:25:d9:6f)
Internet Protocol Version 4, Src: 34.49.233.224, Dst: 192.168.3.103
Transmission Control Protocol, Src Port: 443, Dst Port: 54397, Seq: 1, Ack: 1728, Len: 1412
Transport Layer Security

No.     Time           Source                Destination           Protocol Length Info
  19958 227.652989     34.49.233.224         192.168.3.103         TCP      1466   443 → 54397 [PSH, ACK] Seq=1413 Ack=1728 Win=268288 Len=1412 [TCP PDU reassembled in 19961]

Frame 19958: 1466 bytes on wire (11728 bits), 1466 bytes captured (11728 bits) on interface \Device\NPF_{FF4772B8-9159-442F-8EE1-63F8B1A5EF2A}, id 0
Ethernet II, Src: TendaTechnol_8d:1d:b0 (58:d9:d5:8d:1d:b0), Dst: Intel_25:d9:6f (c8:f7:33:25:d9:6f)
Internet Protocol Version 4, Src: 34.49.233.224, Dst: 192.168.3.103
Transmission Control Protocol, Src Port: 443, Dst Port: 54397, Seq: 1413, Ack: 1728, Len: 1412

No.     Time           Source                Destination           Protocol Length Info
  19959 227.653050     192.168.3.103         34.49.233.224         TCP      54     54397 → 443 [ACK] Seq=1728 Ack=2825 Win=131072 Len=0

Frame 19959: 54 bytes on wire (432 bits), 54 bytes captured (432 bits) on interface \Device\NPF_{FF4772B8-9159-442F-8EE1-63F8B1A5EF2A}, id 0
Ethernet II, Src: Intel_25:d9:6f (c8:f7:33:25:d9:6f), Dst: TendaTechnol_8d:1d:b0 (58:d9:d5:8d:1d:b0)
Internet Protocol Version 4, Src: 192.168.3.103, Dst: 34.49.233.224
Transmission Control Protocol, Src Port: 54397, Dst Port: 443, Seq: 1728, Ack: 2825, Len: 0

No.     Time           Source                Destination           Protocol Length Info
  19960 227.653326     34.49.233.224         192.168.3.103         TCP      1466   443 → 54397 [ACK] Seq=2825 Ack=1728 Win=268288 Len=1412 [TCP PDU reassembled in 19961]

Frame 19960: 1466 bytes on wire (11728 bits), 1466 bytes captured (11728 bits) on interface \Device\NPF_{FF4772B8-9159-442F-8EE1-63F8B1A5EF2A}, id 0
Ethernet II, Src: TendaTechnol_8d:1d:b0 (58:d9:d5:8d:1d:b0), Dst: Intel_25:d9:6f (c8:f7:33:25:d9:6f)
Internet Protocol Version 4, Src: 34.49.233.224, Dst: 192.168.3.103
Transmission Control Protocol, Src Port: 443, Dst Port: 54397, Seq: 2825, Ack: 1728, Len: 1412

No.     Time           Source                Destination           Protocol Length Info
  19961 227.653653     34.49.233.224         192.168.3.103         TLSv1.3  1434   Application Data

Frame 19961: 1434 bytes on wire (11472 bits), 1434 bytes captured (11472 bits) on interface \Device\NPF_{FF4772B8-9159-442F-8EE1-63F8B1A5EF2A}, id 0
Ethernet II, Src: TendaTechnol_8d:1d:b0 (58:d9:d5:8d:1d:b0), Dst: Intel_25:d9:6f (c8:f7:33:25:d9:6f)
Internet Protocol Version 4, Src: 34.49.233.224, Dst: 192.168.3.103
Transmission Control Protocol, Src Port: 443, Dst Port: 54397, Seq: 4237, Ack: 1728, Len: 1380
[4 Reassembled TCP Segments (5483 bytes): #19957(1279), #19958(1412), #19960(1412), #19961(1380)]
Transport Layer Security

No.     Time           Source                Destination           Protocol Length Info
  19962 227.653732     192.168.3.103         34.49.233.224         TCP      54     54397 → 443 [ACK] Seq=1728 Ack=5617 Win=131072 Len=0

Frame 19962: 54 bytes on wire (432 bits), 54 bytes captured (432 bits) on interface \Device\NPF_{FF4772B8-9159-442F-8EE1-63F8B1A5EF2A}, id 0
Ethernet II, Src: Intel_25:d9:6f (c8:f7:33:25:d9:6f), Dst: TendaTechnol_8d:1d:b0 (58:d9:d5:8d:1d:b0)
Internet Protocol Version 4, Src: 192.168.3.103, Dst: 34.49.233.224
Transmission Control Protocol, Src Port: 54397, Dst Port: 443, Seq: 1728, Ack: 5617, Len: 0

No.     Time           Source                Destination           Protocol Length Info
  19963 227.657283     192.168.3.103         34.49.233.224         TLSv1.3  118    Change Cipher Spec, Application Data

Frame 19963: 118 bytes on wire (944 bits), 118 bytes captured (944 bits) on interface \Device\NPF_{FF4772B8-9159-442F-8EE1-63F8B1A5EF2A}, id 0
Ethernet II, Src: Intel_25:d9:6f (c8:f7:33:25:d9:6f), Dst: TendaTechnol_8d:1d:b0 (58:d9:d5:8d:1d:b0)
Internet Protocol Version 4, Src: 192.168.3.103, Dst: 34.49.233.224
Transmission Control Protocol, Src Port: 54396, Dst Port: 443, Seq: 1760, Ack: 5617, Len: 64
Transport Layer Security

No.     Time           Source                Destination           Protocol Length Info
  19964 227.658281     192.168.3.103         34.49.233.224         TLSv1.3  118    Change Cipher Spec, Application Data

Frame 19964: 118 bytes on wire (944 bits), 118 bytes captured (944 bits) on interface \Device\NPF_{FF4772B8-9159-442F-8EE1-63F8B1A5EF2A}, id 0
Ethernet II, Src: Intel_25:d9:6f (c8:f7:33:25:d9:6f), Dst: TendaTechnol_8d:1d:b0 (58:d9:d5:8d:1d:b0)
Internet Protocol Version 4, Src: 192.168.3.103, Dst: 34.49.233.224
Transmission Control Protocol, Src Port: 54397, Dst Port: 443, Seq: 1728, Ack: 5617, Len: 64
Transport Layer Security

No.     Time           Source                Destination           Protocol Length Info
  19965 227.658896     192.168.3.103         34.49.233.224         TCP      54     54397 → 443 [FIN, ACK] Seq=1792 Ack=5617 Win=131072 Len=0

Frame 19965: 54 bytes on wire (432 bits), 54 bytes captured (432 bits) on interface \Device\NPF_{FF4772B8-9159-442F-8EE1-63F8B1A5EF2A}, id 0
Ethernet II, Src: Intel_25:d9:6f (c8:f7:33:25:d9:6f), Dst: TendaTechnol_8d:1d:b0 (58:d9:d5:8d:1d:b0)
Internet Protocol Version 4, Src: 192.168.3.103, Dst: 34.49.233.224
Transmission Control Protocol, Src Port: 54397, Dst Port: 443, Seq: 1792, Ack: 5617, Len: 0

No.     Time           Source                Destination           Protocol Length Info
  19966 227.659375     192.168.3.103         34.49.233.224         TLSv1.3  146    Application Data

Frame 19966: 146 bytes on wire (1168 bits), 146 bytes captured (1168 bits) on interface \Device\NPF_{FF4772B8-9159-442F-8EE1-63F8B1A5EF2A}, id 0
Ethernet II, Src: Intel_25:d9:6f (c8:f7:33:25:d9:6f), Dst: TendaTechnol_8d:1d:b0 (58:d9:d5:8d:1d:b0)
Internet Protocol Version 4, Src: 192.168.3.103, Dst: 34.49.233.224
Transmission Control Protocol, Src Port: 54396, Dst Port: 443, Seq: 1824, Ack: 5617, Len: 92
Transport Layer Security

No.     Time           Source                Destination           Protocol Length Info
  19967 227.659820     192.168.3.103         34.49.233.224         TLSv1.3  572    Application Data

Frame 19967: 572 bytes on wire (4576 bits), 572 bytes captured (4576 bits) on interface \Device\NPF_{FF4772B8-9159-442F-8EE1-63F8B1A5EF2A}, id 0
Ethernet II, Src: Intel_25:d9:6f (c8:f7:33:25:d9:6f), Dst: TendaTechnol_8d:1d:b0 (58:d9:d5:8d:1d:b0)
Internet Protocol Version 4, Src: 192.168.3.103, Dst: 34.49.233.224
Transmission Control Protocol, Src Port: 54396, Dst Port: 443, Seq: 1916, Ack: 5617, Len: 518
Transport Layer Security

No.     Time           Source                Destination           Protocol Length Info
  19968 227.673637     34.49.233.224         192.168.3.103         TLSv1.3  640    Application Data, Application Data

Frame 19968: 640 bytes on wire (5120 bits), 640 bytes captured (5120 bits) on interface \Device\NPF_{FF4772B8-9159-442F-8EE1-63F8B1A5EF2A}, id 0
Ethernet II, Src: TendaTechnol_8d:1d:b0 (58:d9:d5:8d:1d:b0), Dst: Intel_25:d9:6f (c8:f7:33:25:d9:6f)
Internet Protocol Version 4, Src: 34.49.233.224, Dst: 192.168.3.103
Transmission Control Protocol, Src Port: 443, Dst Port: 54396, Seq: 5617, Ack: 1824, Len: 586
Transport Layer Security

No.     Time           Source                Destination           Protocol Length Info
  19969 227.673959     192.168.3.103         34.49.233.224         TLSv1.3  85     Application Data

Frame 19969: 85 bytes on wire (680 bits), 85 bytes captured (680 bits) on interface \Device\NPF_{FF4772B8-9159-442F-8EE1-63F8B1A5EF2A}, id 0
Ethernet II, Src: Intel_25:d9:6f (c8:f7:33:25:d9:6f), Dst: TendaTechnol_8d:1d:b0 (58:d9:d5:8d:1d:b0)
Internet Protocol Version 4, Src: 192.168.3.103, Dst: 34.49.233.224
Transmission Control Protocol, Src Port: 54396, Dst Port: 443, Seq: 2434, Ack: 6203, Len: 31
Transport Layer Security

No.     Time           Source                Destination           Protocol Length Info
  19970 227.674642     34.49.233.224         192.168.3.103         TLSv1.3  640    Application Data, Application Data

Frame 19970: 640 bytes on wire (5120 bits), 640 bytes captured (5120 bits) on interface \Device\NPF_{FF4772B8-9159-442F-8EE1-63F8B1A5EF2A}, id 0
Ethernet II, Src: TendaTechnol_8d:1d:b0 (58:d9:d5:8d:1d:b0), Dst: Intel_25:d9:6f (c8:f7:33:25:d9:6f)
Internet Protocol Version 4, Src: 34.49.233.224, Dst: 192.168.3.103
Transmission Control Protocol, Src Port: 443, Dst Port: 54397, Seq: 5617, Ack: 1792, Len: 586
Transport Layer Security

No.     Time           Source                Destination           Protocol Length Info
  19971 227.674720     192.168.3.103         34.49.233.224         TCP      54     54397 → 443 [RST, ACK] Seq=1793 Ack=6203 Win=0 Len=0

Frame 19971: 54 bytes on wire (432 bits), 54 bytes captured (432 bits) on interface \Device\NPF_{FF4772B8-9159-442F-8EE1-63F8B1A5EF2A}, id 0
Ethernet II, Src: Intel_25:d9:6f (c8:f7:33:25:d9:6f), Dst: TendaTechnol_8d:1d:b0 (58:d9:d5:8d:1d:b0)
Internet Protocol Version 4, Src: 192.168.3.103, Dst: 34.49.233.224
Transmission Control Protocol, Src Port: 54397, Dst Port: 443, Seq: 1793, Ack: 6203, Len: 0

No.     Time           Source                Destination           Protocol Length Info
  19972 227.674939     34.49.233.224         192.168.3.103         TLSv1.3  85     Application Data

Frame 19972: 85 bytes on wire (680 bits), 85 bytes captured (680 bits) on interface \Device\NPF_{FF4772B8-9159-442F-8EE1-63F8B1A5EF2A}, id 0
Ethernet II, Src: TendaTechnol_8d:1d:b0 (58:d9:d5:8d:1d:b0), Dst: Intel_25:d9:6f (c8:f7:33:25:d9:6f)
Internet Protocol Version 4, Src: 34.49.233.224, Dst: 192.168.3.103
Transmission Control Protocol, Src Port: 443, Dst Port: 54396, Seq: 6203, Ack: 1916, Len: 31
Transport Layer Security

No.     Time           Source                Destination           Protocol Length Info
  19973 227.675662     34.49.233.224         192.168.3.103         TCP      54     443 → 54397 [FIN, ACK] Seq=6203 Ack=1793 Win=268288 Len=0

Frame 19973: 54 bytes on wire (432 bits), 54 bytes captured (432 bits) on interface \Device\NPF_{FF4772B8-9159-442F-8EE1-63F8B1A5EF2A}, id 0
Ethernet II, Src: TendaTechnol_8d:1d:b0 (58:d9:d5:8d:1d:b0), Dst: Intel_25:d9:6f (c8:f7:33:25:d9:6f)
Internet Protocol Version 4, Src: 34.49.233.224, Dst: 192.168.3.103
Transmission Control Protocol, Src Port: 443, Dst Port: 54397, Seq: 6203, Ack: 1793, Len: 0

No.     Time           Source                Destination           Protocol Length Info
  19974 227.682138     34.49.233.224         192.168.3.103         TCP      54     443 → 54396 [ACK] Seq=6234 Ack=2434 Win=267776 Len=0

Frame 19974: 54 bytes on wire (432 bits), 54 bytes captured (432 bits) on interface \Device\NPF_{FF4772B8-9159-442F-8EE1-63F8B1A5EF2A}, id 0
Ethernet II, Src: TendaTechnol_8d:1d:b0 (58:d9:d5:8d:1d:b0), Dst: Intel_25:d9:6f (c8:f7:33:25:d9:6f)
Internet Protocol Version 4, Src: 34.49.233.224, Dst: 192.168.3.103
Transmission Control Protocol, Src Port: 443, Dst Port: 54396, Seq: 6234, Ack: 2434, Len: 0

No.     Time           Source                Destination           Protocol Length Info
  19975 227.691112     34.49.233.224         192.168.3.103         TCP      54     443 → 54396 [ACK] Seq=6234 Ack=2465 Win=267776 Len=0

Frame 19975: 54 bytes on wire (432 bits), 54 bytes captured (432 bits) on interface \Device\NPF_{FF4772B8-9159-442F-8EE1-63F8B1A5EF2A}, id 0
Ethernet II, Src: TendaTechnol_8d:1d:b0 (58:d9:d5:8d:1d:b0), Dst: Intel_25:d9:6f (c8:f7:33:25:d9:6f)
Internet Protocol Version 4, Src: 34.49.233.224, Dst: 192.168.3.103
Transmission Control Protocol, Src Port: 443, Dst Port: 54396, Seq: 6234, Ack: 2465, Len: 0

No.     Time           Source                Destination           Protocol Length Info
  19976 227.720092     192.168.3.103         34.49.233.224         TCP      54     54396 → 443 [ACK] Seq=2465 Ack=6234 Win=130560 Len=0

Frame 19976: 54 bytes on wire (432 bits), 54 bytes captured (432 bits) on interface \Device\NPF_{FF4772B8-9159-442F-8EE1-63F8B1A5EF2A}, id 0
Ethernet II, Src: Intel_25:d9:6f (c8:f7:33:25:d9:6f), Dst: TendaTechnol_8d:1d:b0 (58:d9:d5:8d:1d:b0)
Internet Protocol Version 4, Src: 192.168.3.103, Dst: 34.49.233.224
Transmission Control Protocol, Src Port: 54396, Dst Port: 443, Seq: 2465, Ack: 6234, Len: 0

No.     Time           Source                Destination           Protocol Length Info
  19978 228.569549     34.49.233.224         192.168.3.103         TLSv1.3  309    Application Data

Frame 19978: 309 bytes on wire (2472 bits), 309 bytes captured (2472 bits) on interface \Device\NPF_{FF4772B8-9159-442F-8EE1-63F8B1A5EF2A}, id 0
Ethernet II, Src: TendaTechnol_8d:1d:b0 (58:d9:d5:8d:1d:b0), Dst: Intel_25:d9:6f (c8:f7:33:25:d9:6f)
Internet Protocol Version 4, Src: 34.49.233.224, Dst: 192.168.3.103
Transmission Control Protocol, Src Port: 443, Dst Port: 54396, Seq: 6234, Ack: 2465, Len: 255
Transport Layer Security

No.     Time           Source                Destination           Protocol Length Info
  19979 228.572319     34.49.233.224         192.168.3.103         TLSv1.3  323    Application Data

Frame 19979: 323 bytes on wire (2584 bits), 323 bytes captured (2584 bits) on interface \Device\NPF_{FF4772B8-9159-442F-8EE1-63F8B1A5EF2A}, id 0
Ethernet II, Src: TendaTechnol_8d:1d:b0 (58:d9:d5:8d:1d:b0), Dst: Intel_25:d9:6f (c8:f7:33:25:d9:6f)
Internet Protocol Version 4, Src: 34.49.233.224, Dst: 192.168.3.103
Transmission Control Protocol, Src Port: 443, Dst Port: 54396, Seq: 6489, Ack: 2465, Len: 269
Transport Layer Security

No.     Time           Source                Destination           Protocol Length Info
  19980 228.572485     192.168.3.103         34.49.233.224         TCP      54     54396 → 443 [ACK] Seq=2465 Ack=6758 Win=130048 Len=0

Frame 19980: 54 bytes on wire (432 bits), 54 bytes captured (432 bits) on interface \Device\NPF_{FF4772B8-9159-442F-8EE1-63F8B1A5EF2A}, id 0
Ethernet II, Src: Intel_25:d9:6f (c8:f7:33:25:d9:6f), Dst: TendaTechnol_8d:1d:b0 (58:d9:d5:8d:1d:b0)
Internet Protocol Version 4, Src: 192.168.3.103, Dst: 34.49.233.224
Transmission Control Protocol, Src Port: 54396, Dst Port: 443, Seq: 2465, Ack: 6758, Len: 0

No.     Time           Source                Destination           Protocol Length Info
  19981 228.573437     34.49.233.224         192.168.3.103         TLSv1.3  85     Application Data

Frame 19981: 85 bytes on wire (680 bits), 85 bytes captured (680 bits) on interface \Device\NPF_{FF4772B8-9159-442F-8EE1-63F8B1A5EF2A}, id 0
Ethernet II, Src: TendaTechnol_8d:1d:b0 (58:d9:d5:8d:1d:b0), Dst: Intel_25:d9:6f (c8:f7:33:25:d9:6f)
Internet Protocol Version 4, Src: 34.49.233.224, Dst: 192.168.3.103
Transmission Control Protocol, Src Port: 443, Dst Port: 54396, Seq: 6758, Ack: 2465, Len: 31
Transport Layer Security

No.     Time           Source                Destination           Protocol Length Info
  19982 228.573437     34.49.233.224         192.168.3.103         TLSv1.3  93     Application Data

Frame 19982: 93 bytes on wire (744 bits), 93 bytes captured (744 bits) on interface \Device\NPF_{FF4772B8-9159-442F-8EE1-63F8B1A5EF2A}, id 0
Ethernet II, Src: TendaTechnol_8d:1d:b0 (58:d9:d5:8d:1d:b0), Dst: Intel_25:d9:6f (c8:f7:33:25:d9:6f)
Internet Protocol Version 4, Src: 34.49.233.224, Dst: 192.168.3.103
Transmission Control Protocol, Src Port: 443, Dst Port: 54396, Seq: 6789, Ack: 2465, Len: 39
Transport Layer Security

No.     Time           Source                Destination           Protocol Length Info
  19983 228.573640     192.168.3.103         34.49.233.224         TCP      54     54396 → 443 [ACK] Seq=2465 Ack=6828 Win=130048 Len=0

Frame 19983: 54 bytes on wire (432 bits), 54 bytes captured (432 bits) on interface \Device\NPF_{FF4772B8-9159-442F-8EE1-63F8B1A5EF2A}, id 0
Ethernet II, Src: Intel_25:d9:6f (c8:f7:33:25:d9:6f), Dst: TendaTechnol_8d:1d:b0 (58:d9:d5:8d:1d:b0)
Internet Protocol Version 4, Src: 192.168.3.103, Dst: 34.49.233.224
Transmission Control Protocol, Src Port: 54396, Dst Port: 443, Seq: 2465, Ack: 6828, Len: 0

No.     Time           Source                Destination           Protocol Length Info
  19984 228.574153     192.168.3.103         34.49.233.224         TLSv1.3  93     Application Data

Frame 19984: 93 bytes on wire (744 bits), 93 bytes captured (744 bits) on interface \Device\NPF_{FF4772B8-9159-442F-8EE1-63F8B1A5EF2A}, id 0
Ethernet II, Src: Intel_25:d9:6f (c8:f7:33:25:d9:6f), Dst: TendaTechnol_8d:1d:b0 (58:d9:d5:8d:1d:b0)
Internet Protocol Version 4, Src: 192.168.3.103, Dst: 34.49.233.224
Transmission Control Protocol, Src Port: 54396, Dst Port: 443, Seq: 2465, Ack: 6828, Len: 39
Transport Layer Security

No.     Time           Source                Destination           Protocol Length Info
  19988 228.590408     34.49.233.224         192.168.3.103         TCP      54     443 → 54396 [ACK] Seq=6828 Ack=2504 Win=267776 Len=0

Frame 19988: 54 bytes on wire (432 bits), 54 bytes captured (432 bits) on interface \Device\NPF_{FF4772B8-9159-442F-8EE1-63F8B1A5EF2A}, id 0
Ethernet II, Src: TendaTechnol_8d:1d:b0 (58:d9:d5:8d:1d:b0), Dst: Intel_25:d9:6f (c8:f7:33:25:d9:6f)
Internet Protocol Version 4, Src: 34.49.233.224, Dst: 192.168.3.103
Transmission Control Protocol, Src Port: 443, Dst Port: 54396, Seq: 6828, Ack: 2504, Len: 0

No.     Time           Source                Destination           Protocol Length Info
  33933 258.608426     34.49.233.224         192.168.3.103         TCP      54     [TCP Keep-Alive] 443 → 54396 [ACK] Seq=6827 Ack=2504 Win=267776 Len=0

Frame 33933: 54 bytes on wire (432 bits), 54 bytes captured (432 bits) on interface \Device\NPF_{FF4772B8-9159-442F-8EE1-63F8B1A5EF2A}, id 0
Ethernet II, Src: TendaTechnol_8d:1d:b0 (58:d9:d5:8d:1d:b0), Dst: Intel_25:d9:6f (c8:f7:33:25:d9:6f)
Internet Protocol Version 4, Src: 34.49.233.224, Dst: 192.168.3.103
Transmission Control Protocol, Src Port: 443, Dst Port: 54396, Seq: 6827, Ack: 2504, Len: 0

No.     Time           Source                Destination           Protocol Length Info
  33934 258.608492     192.168.3.103         34.49.233.224         TCP      54     [TCP Keep-Alive ACK] 54396 → 443 [ACK] Seq=2504 Ack=6828 Win=130048 Len=0

Frame 33934: 54 bytes on wire (432 bits), 54 bytes captured (432 bits) on interface \Device\NPF_{FF4772B8-9159-442F-8EE1-63F8B1A5EF2A}, id 0
Ethernet II, Src: Intel_25:d9:6f (c8:f7:33:25:d9:6f), Dst: TendaTechnol_8d:1d:b0 (58:d9:d5:8d:1d:b0)
Internet Protocol Version 4, Src: 192.168.3.103, Dst: 34.49.233.224
Transmission Control Protocol, Src Port: 54396, Dst Port: 443, Seq: 2504, Ack: 6828, Len: 0

No.     Time           Source                Destination           Protocol Length Info
  36992 273.600558     192.168.3.103         34.49.233.224         TCP      55     [TCP Keep-Alive] 54396 → 443 [ACK] Seq=2503 Ack=6828 Win=130048 Len=1

Frame 36992: 55 bytes on wire (440 bits), 55 bytes captured (440 bits) on interface \Device\NPF_{FF4772B8-9159-442F-8EE1-63F8B1A5EF2A}, id 0
Ethernet II, Src: Intel_25:d9:6f (c8:f7:33:25:d9:6f), Dst: TendaTechnol_8d:1d:b0 (58:d9:d5:8d:1d:b0)
Internet Protocol Version 4, Src: 192.168.3.103, Dst: 34.49.233.224
Transmission Control Protocol, Src Port: 54396, Dst Port: 443, Seq: 2503, Ack: 6828, Len: 1
Data (1 byte)

0000  00                                                .

No.     Time           Source                Destination           Protocol Length Info
  36993 273.616603     34.49.233.224         192.168.3.103         TCP      66     [TCP Keep-Alive ACK] 443 → 54396 [ACK] Seq=6828 Ack=2504 Win=267776 Len=0 SLE=2503 SRE=2504

Frame 36993: 66 bytes on wire (528 bits), 66 bytes captured (528 bits) on interface \Device\NPF_{FF4772B8-9159-442F-8EE1-63F8B1A5EF2A}, id 0
Ethernet II, Src: TendaTechnol_8d:1d:b0 (58:d9:d5:8d:1d:b0), Dst: Intel_25:d9:6f (c8:f7:33:25:d9:6f)
Internet Protocol Version 4, Src: 34.49.233.224, Dst: 192.168.3.103
Transmission Control Protocol, Src Port: 443, Dst Port: 54396, Seq: 6828, Ack: 2504, Len: 0

No.     Time           Source                Destination           Protocol Length Info
  40895 303.603104     34.49.233.224         192.168.3.103         TCP      54     [TCP Keep-Alive] 443 → 54396 [ACK] Seq=6827 Ack=2504 Win=267776 Len=0

Frame 40895: 54 bytes on wire (432 bits), 54 bytes captured (432 bits) on interface \Device\NPF_{FF4772B8-9159-442F-8EE1-63F8B1A5EF2A}, id 0
Ethernet II, Src: TendaTechnol_8d:1d:b0 (58:d9:d5:8d:1d:b0), Dst: Intel_25:d9:6f (c8:f7:33:25:d9:6f)
Internet Protocol Version 4, Src: 34.49.233.224, Dst: 192.168.3.103
Transmission Control Protocol, Src Port: 443, Dst Port: 54396, Seq: 6827, Ack: 2504, Len: 0

No.     Time           Source                Destination           Protocol Length Info
  40896 303.603177     192.168.3.103         34.49.233.224         TCP      54     [TCP Keep-Alive ACK] 54396 → 443 [ACK] Seq=2504 Ack=6828 Win=130048 Len=0

Frame 40896: 54 bytes on wire (432 bits), 54 bytes captured (432 bits) on interface \Device\NPF_{FF4772B8-9159-442F-8EE1-63F8B1A5EF2A}, id 0
Ethernet II, Src: Intel_25:d9:6f (c8:f7:33:25:d9:6f), Dst: TendaTechnol_8d:1d:b0 (58:d9:d5:8d:1d:b0)
Internet Protocol Version 4, Src: 192.168.3.103, Dst: 34.49.233.224
Transmission Control Protocol, Src Port: 54396, Dst Port: 443, Seq: 2504, Ack: 6828, Len: 0

No.     Time           Source                Destination           Protocol Length Info
  45158 318.630787     192.168.3.103         34.49.233.224         TCP      55     [TCP Keep-Alive] 54396 → 443 [ACK] Seq=2503 Ack=6828 Win=130048 Len=1

Frame 45158: 55 bytes on wire (440 bits), 55 bytes captured (440 bits) on interface \Device\NPF_{FF4772B8-9159-442F-8EE1-63F8B1A5EF2A}, id 0
Ethernet II, Src: Intel_25:d9:6f (c8:f7:33:25:d9:6f), Dst: TendaTechnol_8d:1d:b0 (58:d9:d5:8d:1d:b0)
Internet Protocol Version 4, Src: 192.168.3.103, Dst: 34.49.233.224
Transmission Control Protocol, Src Port: 54396, Dst Port: 443, Seq: 2503, Ack: 6828, Len: 1
Data (1 byte)

0000  00                                                .

No.     Time           Source                Destination           Protocol Length Info
  45159 318.646658     34.49.233.224         192.168.3.103         TCP      66     [TCP Keep-Alive ACK] 443 → 54396 [ACK] Seq=6828 Ack=2504 Win=267776 Len=0 SLE=2503 SRE=2504

Frame 45159: 66 bytes on wire (528 bits), 66 bytes captured (528 bits) on interface \Device\NPF_{FF4772B8-9159-442F-8EE1-63F8B1A5EF2A}, id 0
Ethernet II, Src: TendaTechnol_8d:1d:b0 (58:d9:d5:8d:1d:b0), Dst: Intel_25:d9:6f (c8:f7:33:25:d9:6f)
Internet Protocol Version 4, Src: 34.49.233.224, Dst: 192.168.3.103
Transmission Control Protocol, Src Port: 443, Dst Port: 54396, Seq: 6828, Ack: 2504, Len: 0

No.     Time           Source                Destination           Protocol Length Info
  46122 348.602051     34.49.233.224         192.168.3.103         TCP      54     [TCP Keep-Alive] 443 → 54396 [ACK] Seq=6827 Ack=2504 Win=267776 Len=0

Frame 46122: 54 bytes on wire (432 bits), 54 bytes captured (432 bits) on interface \Device\NPF_{FF4772B8-9159-442F-8EE1-63F8B1A5EF2A}, id 0
Ethernet II, Src: TendaTechnol_8d:1d:b0 (58:d9:d5:8d:1d:b0), Dst: Intel_25:d9:6f (c8:f7:33:25:d9:6f)
Internet Protocol Version 4, Src: 34.49.233.224, Dst: 192.168.3.103
Transmission Control Protocol, Src Port: 443, Dst Port: 54396, Seq: 6827, Ack: 2504, Len: 0

No.     Time           Source                Destination           Protocol Length Info
  46123 348.602177     192.168.3.103         34.49.233.224         TCP      54     [TCP Keep-Alive ACK] 54396 → 443 [ACK] Seq=2504 Ack=6828 Win=130048 Len=0

Frame 46123: 54 bytes on wire (432 bits), 54 bytes captured (432 bits) on interface \Device\NPF_{FF4772B8-9159-442F-8EE1-63F8B1A5EF2A}, id 0
Ethernet II, Src: Intel_25:d9:6f (c8:f7:33:25:d9:6f), Dst: TendaTechnol_8d:1d:b0 (58:d9:d5:8d:1d:b0)
Internet Protocol Version 4, Src: 192.168.3.103, Dst: 34.49.233.224
Transmission Control Protocol, Src Port: 54396, Dst Port: 443, Seq: 2504, Ack: 6828, Len: 0

No.     Time           Source                Destination           Protocol Length Info
  48397 363.651199     192.168.3.103         34.49.233.224         TCP      55     [TCP Keep-Alive] 54396 → 443 [ACK] Seq=2503 Ack=6828 Win=130048 Len=1

Frame 48397: 55 bytes on wire (440 bits), 55 bytes captured (440 bits) on interface \Device\NPF_{FF4772B8-9159-442F-8EE1-63F8B1A5EF2A}, id 0
Ethernet II, Src: Intel_25:d9:6f (c8:f7:33:25:d9:6f), Dst: TendaTechnol_8d:1d:b0 (58:d9:d5:8d:1d:b0)
Internet Protocol Version 4, Src: 192.168.3.103, Dst: 34.49.233.224
Transmission Control Protocol, Src Port: 54396, Dst Port: 443, Seq: 2503, Ack: 6828, Len: 1
Data (1 byte)

0000  00                                                .

No.     Time           Source                Destination           Protocol Length Info
  48398 363.669320     34.49.233.224         192.168.3.103         TCP      66     [TCP Keep-Alive ACK] 443 → 54396 [ACK] Seq=6828 Ack=2504 Win=267776 Len=0 SLE=2503 SRE=2504

Frame 48398: 66 bytes on wire (528 bits), 66 bytes captured (528 bits) on interface \Device\NPF_{FF4772B8-9159-442F-8EE1-63F8B1A5EF2A}, id 0
Ethernet II, Src: TendaTechnol_8d:1d:b0 (58:d9:d5:8d:1d:b0), Dst: Intel_25:d9:6f (c8:f7:33:25:d9:6f)
Internet Protocol Version 4, Src: 34.49.233.224, Dst: 192.168.3.103
Transmission Control Protocol, Src Port: 443, Dst Port: 54396, Seq: 6828, Ack: 2504, Len: 0

No.     Time           Source                Destination           Protocol Length Info
  51157 393.729726     34.49.233.224         192.168.3.103         TCP      54     [TCP Keep-Alive] 443 → 54396 [ACK] Seq=6827 Ack=2504 Win=267776 Len=0

Frame 51157: 54 bytes on wire (432 bits), 54 bytes captured (432 bits) on interface \Device\NPF_{FF4772B8-9159-442F-8EE1-63F8B1A5EF2A}, id 0
Ethernet II, Src: TendaTechnol_8d:1d:b0 (58:d9:d5:8d:1d:b0), Dst: Intel_25:d9:6f (c8:f7:33:25:d9:6f)
Internet Protocol Version 4, Src: 34.49.233.224, Dst: 192.168.3.103
Transmission Control Protocol, Src Port: 443, Dst Port: 54396, Seq: 6827, Ack: 2504, Len: 0

No.     Time           Source                Destination           Protocol Length Info
  51158 393.730012     192.168.3.103         34.49.233.224         TCP      54     [TCP Keep-Alive ACK] 54396 → 443 [ACK] Seq=2504 Ack=6828 Win=130048 Len=0

Frame 51158: 54 bytes on wire (432 bits), 54 bytes captured (432 bits) on interface \Device\NPF_{FF4772B8-9159-442F-8EE1-63F8B1A5EF2A}, id 0
Ethernet II, Src: Intel_25:d9:6f (c8:f7:33:25:d9:6f), Dst: TendaTechnol_8d:1d:b0 (58:d9:d5:8d:1d:b0)
Internet Protocol Version 4, Src: 192.168.3.103, Dst: 34.49.233.224
Transmission Control Protocol, Src Port: 54396, Dst Port: 443, Seq: 2504, Ack: 6828, Len: 0

No.     Time           Source                Destination           Protocol Length Info
  56033 408.680251     192.168.3.103         34.49.233.224         TCP      55     [TCP Keep-Alive] 54396 → 443 [ACK] Seq=2503 Ack=6828 Win=130048 Len=1

Frame 56033: 55 bytes on wire (440 bits), 55 bytes captured (440 bits) on interface \Device\NPF_{FF4772B8-9159-442F-8EE1-63F8B1A5EF2A}, id 0
Ethernet II, Src: Intel_25:d9:6f (c8:f7:33:25:d9:6f), Dst: TendaTechnol_8d:1d:b0 (58:d9:d5:8d:1d:b0)
Internet Protocol Version 4, Src: 192.168.3.103, Dst: 34.49.233.224
Transmission Control Protocol, Src Port: 54396, Dst Port: 443, Seq: 2503, Ack: 6828, Len: 1
Data (1 byte)

0000  00                                                .

No.     Time           Source                Destination           Protocol Length Info
  56038 408.816406     34.49.233.224         192.168.3.103         TCP      66     [TCP Keep-Alive ACK] 443 → 54396 [ACK] Seq=6828 Ack=2504 Win=267776 Len=0 SLE=2503 SRE=2504

Frame 56038: 66 bytes on wire (528 bits), 66 bytes captured (528 bits) on interface \Device\NPF_{FF4772B8-9159-442F-8EE1-63F8B1A5EF2A}, id 0
Ethernet II, Src: TendaTechnol_8d:1d:b0 (58:d9:d5:8d:1d:b0), Dst: Intel_25:d9:6f (c8:f7:33:25:d9:6f)
Internet Protocol Version 4, Src: 34.49.233.224, Dst: 192.168.3.103
Transmission Control Protocol, Src Port: 443, Dst Port: 54396, Seq: 6828, Ack: 2504, Len: 0

No.     Time           Source                Destination           Protocol Length Info
  59422 439.747999     34.49.233.224         192.168.3.103         TCP      54     [TCP Keep-Alive] 443 → 54396 [ACK] Seq=6827 Ack=2504 Win=267776 Len=0

Frame 59422: 54 bytes on wire (432 bits), 54 bytes captured (432 bits) on interface \Device\NPF_{FF4772B8-9159-442F-8EE1-63F8B1A5EF2A}, id 0
Ethernet II, Src: TendaTechnol_8d:1d:b0 (58:d9:d5:8d:1d:b0), Dst: Intel_25:d9:6f (c8:f7:33:25:d9:6f)
Internet Protocol Version 4, Src: 34.49.233.224, Dst: 192.168.3.103
Transmission Control Protocol, Src Port: 443, Dst Port: 54396, Seq: 6827, Ack: 2504, Len: 0

No.     Time           Source                Destination           Protocol Length Info
  59425 439.748094     192.168.3.103         34.49.233.224         TCP      54     [TCP Keep-Alive ACK] 54396 → 443 [ACK] Seq=2504 Ack=6828 Win=130048 Len=0

Frame 59425: 54 bytes on wire (432 bits), 54 bytes captured (432 bits) on interface \Device\NPF_{FF4772B8-9159-442F-8EE1-63F8B1A5EF2A}, id 0
Ethernet II, Src: Intel_25:d9:6f (c8:f7:33:25:d9:6f), Dst: TendaTechnol_8d:1d:b0 (58:d9:d5:8d:1d:b0)
Internet Protocol Version 4, Src: 192.168.3.103, Dst: 34.49.233.224
Transmission Control Protocol, Src Port: 54396, Dst Port: 443, Seq: 2504, Ack: 6828, Len: 0

No.     Time           Source                Destination           Protocol Length Info
  63023 453.820814     192.168.3.103         34.49.233.224         TCP      55     [TCP Keep-Alive] 54396 → 443 [ACK] Seq=2503 Ack=6828 Win=130048 Len=1

Frame 63023: 55 bytes on wire (440 bits), 55 bytes captured (440 bits) on interface \Device\NPF_{FF4772B8-9159-442F-8EE1-63F8B1A5EF2A}, id 0
Ethernet II, Src: Intel_25:d9:6f (c8:f7:33:25:d9:6f), Dst: TendaTechnol_8d:1d:b0 (58:d9:d5:8d:1d:b0)
Internet Protocol Version 4, Src: 192.168.3.103, Dst: 34.49.233.224
Transmission Control Protocol, Src Port: 54396, Dst Port: 443, Seq: 2503, Ack: 6828, Len: 1
Data (1 byte)

0000  00                                                .

No.     Time           Source                Destination           Protocol Length Info
  63137 453.909970     34.49.233.224         192.168.3.103         TCP      66     [TCP Keep-Alive ACK] 443 → 54396 [ACK] Seq=6828 Ack=2504 Win=267776 Len=0 SLE=2503 SRE=2504

Frame 63137: 66 bytes on wire (528 bits), 66 bytes captured (528 bits) on interface \Device\NPF_{FF4772B8-9159-442F-8EE1-63F8B1A5EF2A}, id 0
Ethernet II, Src: TendaTechnol_8d:1d:b0 (58:d9:d5:8d:1d:b0), Dst: Intel_25:d9:6f (c8:f7:33:25:d9:6f)
Internet Protocol Version 4, Src: 34.49.233.224, Dst: 192.168.3.103
Transmission Control Protocol, Src Port: 443, Dst Port: 54396, Seq: 6828, Ack: 2504, Len: 0

No.     Time           Source                Destination           Protocol Length Info
  76417 484.603291     34.49.233.224         192.168.3.103         TCP      54     [TCP Keep-Alive] 443 → 54396 [ACK] Seq=6827 Ack=2504 Win=267776 Len=0

Frame 76417: 54 bytes on wire (432 bits), 54 bytes captured (432 bits) on interface \Device\NPF_{FF4772B8-9159-442F-8EE1-63F8B1A5EF2A}, id 0
Ethernet II, Src: TendaTechnol_8d:1d:b0 (58:d9:d5:8d:1d:b0), Dst: Intel_25:d9:6f (c8:f7:33:25:d9:6f)
Internet Protocol Version 4, Src: 34.49.233.224, Dst: 192.168.3.103
Transmission Control Protocol, Src Port: 443, Dst Port: 54396, Seq: 6827, Ack: 2504, Len: 0

No.     Time           Source                Destination           Protocol Length Info
  76418 484.603355     192.168.3.103         34.49.233.224         TCP      54     [TCP Keep-Alive ACK] 54396 → 443 [ACK] Seq=2504 Ack=6828 Win=130048 Len=0

Frame 76418: 54 bytes on wire (432 bits), 54 bytes captured (432 bits) on interface \Device\NPF_{FF4772B8-9159-442F-8EE1-63F8B1A5EF2A}, id 0
Ethernet II, Src: Intel_25:d9:6f (c8:f7:33:25:d9:6f), Dst: TendaTechnol_8d:1d:b0 (58:d9:d5:8d:1d:b0)
Internet Protocol Version 4, Src: 192.168.3.103, Dst: 34.49.233.224
Transmission Control Protocol, Src Port: 54396, Dst Port: 443, Seq: 2504, Ack: 6828, Len: 0

No.     Time           Source                Destination           Protocol Length Info
  81257 498.917572     192.168.3.103         34.49.233.224         TCP      55     [TCP Keep-Alive] 54396 → 443 [ACK] Seq=2503 Ack=6828 Win=130048 Len=1

Frame 81257: 55 bytes on wire (440 bits), 55 bytes captured (440 bits) on interface \Device\NPF_{FF4772B8-9159-442F-8EE1-63F8B1A5EF2A}, id 0
Ethernet II, Src: Intel_25:d9:6f (c8:f7:33:25:d9:6f), Dst: TendaTechnol_8d:1d:b0 (58:d9:d5:8d:1d:b0)
Internet Protocol Version 4, Src: 192.168.3.103, Dst: 34.49.233.224
Transmission Control Protocol, Src Port: 54396, Dst Port: 443, Seq: 2503, Ack: 6828, Len: 1
Data (1 byte)

0000  00                                                .

No.     Time           Source                Destination           Protocol Length Info
  81325 499.084094     34.49.233.224         192.168.3.103         TCP      66     [TCP Keep-Alive ACK] 443 → 54396 [ACK] Seq=6828 Ack=2504 Win=267776 Len=0 SLE=2503 SRE=2504

Frame 81325: 66 bytes on wire (528 bits), 66 bytes captured (528 bits) on interface \Device\NPF_{FF4772B8-9159-442F-8EE1-63F8B1A5EF2A}, id 0
Ethernet II, Src: TendaTechnol_8d:1d:b0 (58:d9:d5:8d:1d:b0), Dst: Intel_25:d9:6f (c8:f7:33:25:d9:6f)
Internet Protocol Version 4, Src: 34.49.233.224, Dst: 192.168.3.103
Transmission Control Protocol, Src Port: 443, Dst Port: 54396, Seq: 6828, Ack: 2504, Len: 0

No.     Time           Source                Destination           Protocol Length Info
  82513 529.599407     34.49.233.224         192.168.3.103         TCP      54     [TCP Keep-Alive] 443 → 54396 [ACK] Seq=6827 Ack=2504 Win=267776 Len=0

Frame 82513: 54 bytes on wire (432 bits), 54 bytes captured (432 bits) on interface \Device\NPF_{FF4772B8-9159-442F-8EE1-63F8B1A5EF2A}, id 0
Ethernet II, Src: TendaTechnol_8d:1d:b0 (58:d9:d5:8d:1d:b0), Dst: Intel_25:d9:6f (c8:f7:33:25:d9:6f)
Internet Protocol Version 4, Src: 34.49.233.224, Dst: 192.168.3.103
Transmission Control Protocol, Src Port: 443, Dst Port: 54396, Seq: 6827, Ack: 2504, Len: 0

No.     Time           Source                Destination           Protocol Length Info
  82514 529.599516     192.168.3.103         34.49.233.224         TCP      54     [TCP Keep-Alive ACK] 54396 → 443 [ACK] Seq=2504 Ack=6828 Win=130048 Len=0

Frame 82514: 54 bytes on wire (432 bits), 54 bytes captured (432 bits) on interface \Device\NPF_{FF4772B8-9159-442F-8EE1-63F8B1A5EF2A}, id 0
Ethernet II, Src: Intel_25:d9:6f (c8:f7:33:25:d9:6f), Dst: TendaTechnol_8d:1d:b0 (58:d9:d5:8d:1d:b0)
Internet Protocol Version 4, Src: 192.168.3.103, Dst: 34.49.233.224
Transmission Control Protocol, Src Port: 54396, Dst Port: 443, Seq: 2504, Ack: 6828, Len: 0

No.     Time           Source                Destination           Protocol Length Info
  82653 544.085452     192.168.3.103         34.49.233.224         TCP      55     [TCP Keep-Alive] 54396 → 443 [ACK] Seq=2503 Ack=6828 Win=130048 Len=1

Frame 82653: 55 bytes on wire (440 bits), 55 bytes captured (440 bits) on interface \Device\NPF_{FF4772B8-9159-442F-8EE1-63F8B1A5EF2A}, id 0
Ethernet II, Src: Intel_25:d9:6f (c8:f7:33:25:d9:6f), Dst: TendaTechnol_8d:1d:b0 (58:d9:d5:8d:1d:b0)
Internet Protocol Version 4, Src: 192.168.3.103, Dst: 34.49.233.224
Transmission Control Protocol, Src Port: 54396, Dst Port: 443, Seq: 2503, Ack: 6828, Len: 1
Data (1 byte)

0000  00                                                .

No.     Time           Source                Destination           Protocol Length Info
  82654 544.101942     34.49.233.224         192.168.3.103         TCP      66     [TCP Keep-Alive ACK] 443 → 54396 [ACK] Seq=6828 Ack=2504 Win=267776 Len=0 SLE=2503 SRE=2504

Frame 82654: 66 bytes on wire (528 bits), 66 bytes captured (528 bits) on interface \Device\NPF_{FF4772B8-9159-442F-8EE1-63F8B1A5EF2A}, id 0
Ethernet II, Src: TendaTechnol_8d:1d:b0 (58:d9:d5:8d:1d:b0), Dst: Intel_25:d9:6f (c8:f7:33:25:d9:6f)
Internet Protocol Version 4, Src: 34.49.233.224, Dst: 192.168.3.103
Transmission Control Protocol, Src Port: 443, Dst Port: 54396, Seq: 6828, Ack: 2504, Len: 0

No.     Time           Source                Destination           Protocol Length Info
  85512 574.599392     34.49.233.224         192.168.3.103         TCP      54     [TCP Keep-Alive] 443 → 54396 [ACK] Seq=6827 Ack=2504 Win=267776 Len=0

Frame 85512: 54 bytes on wire (432 bits), 54 bytes captured (432 bits) on interface \Device\NPF_{FF4772B8-9159-442F-8EE1-63F8B1A5EF2A}, id 0
Ethernet II, Src: TendaTechnol_8d:1d:b0 (58:d9:d5:8d:1d:b0), Dst: Intel_25:d9:6f (c8:f7:33:25:d9:6f)
Internet Protocol Version 4, Src: 34.49.233.224, Dst: 192.168.3.103
Transmission Control Protocol, Src Port: 443, Dst Port: 54396, Seq: 6827, Ack: 2504, Len: 0

No.     Time           Source                Destination           Protocol Length Info
  85513 574.599494     192.168.3.103         34.49.233.224         TCP      54     [TCP Keep-Alive ACK] 54396 → 443 [ACK] Seq=2504 Ack=6828 Win=130048 Len=0

Frame 85513: 54 bytes on wire (432 bits), 54 bytes captured (432 bits) on interface \Device\NPF_{FF4772B8-9159-442F-8EE1-63F8B1A5EF2A}, id 0
Ethernet II, Src: Intel_25:d9:6f (c8:f7:33:25:d9:6f), Dst: TendaTechnol_8d:1d:b0 (58:d9:d5:8d:1d:b0)
Internet Protocol Version 4, Src: 192.168.3.103, Dst: 34.49.233.224
Transmission Control Protocol, Src Port: 54396, Dst Port: 443, Seq: 2504, Ack: 6828, Len: 0

No.     Time           Source                Destination           Protocol Length Info
  85824 589.120037     192.168.3.103         34.49.233.224         TCP      55     [TCP Keep-Alive] 54396 → 443 [ACK] Seq=2503 Ack=6828 Win=130048 Len=1

Frame 85824: 55 bytes on wire (440 bits), 55 bytes captured (440 bits) on interface \Device\NPF_{FF4772B8-9159-442F-8EE1-63F8B1A5EF2A}, id 0
Ethernet II, Src: Intel_25:d9:6f (c8:f7:33:25:d9:6f), Dst: TendaTechnol_8d:1d:b0 (58:d9:d5:8d:1d:b0)
Internet Protocol Version 4, Src: 192.168.3.103, Dst: 34.49.233.224
Transmission Control Protocol, Src Port: 54396, Dst Port: 443, Seq: 2503, Ack: 6828, Len: 1
Data (1 byte)

0000  00                                                .

No.     Time           Source                Destination           Protocol Length Info
  85825 589.136307     34.49.233.224         192.168.3.103         TCP      66     [TCP Keep-Alive ACK] 443 → 54396 [ACK] Seq=6828 Ack=2504 Win=267776 Len=0 SLE=2503 SRE=2504

Frame 85825: 66 bytes on wire (528 bits), 66 bytes captured (528 bits) on interface \Device\NPF_{FF4772B8-9159-442F-8EE1-63F8B1A5EF2A}, id 0
Ethernet II, Src: TendaTechnol_8d:1d:b0 (58:d9:d5:8d:1d:b0), Dst: Intel_25:d9:6f (c8:f7:33:25:d9:6f)
Internet Protocol Version 4, Src: 34.49.233.224, Dst: 192.168.3.103
Transmission Control Protocol, Src Port: 443, Dst Port: 54396, Seq: 6828, Ack: 2504, Len: 0

No.     Time           Source                Destination           Protocol Length Info
  87305 619.597333     34.49.233.224         192.168.3.103         TCP      54     [TCP Keep-Alive] 443 → 54396 [ACK] Seq=6827 Ack=2504 Win=267776 Len=0

Frame 87305: 54 bytes on wire (432 bits), 54 bytes captured (432 bits) on interface \Device\NPF_{FF4772B8-9159-442F-8EE1-63F8B1A5EF2A}, id 0
Ethernet II, Src: TendaTechnol_8d:1d:b0 (58:d9:d5:8d:1d:b0), Dst: Intel_25:d9:6f (c8:f7:33:25:d9:6f)
Internet Protocol Version 4, Src: 34.49.233.224, Dst: 192.168.3.103
Transmission Control Protocol, Src Port: 443, Dst Port: 54396, Seq: 6827, Ack: 2504, Len: 0

No.     Time           Source                Destination           Protocol Length Info
  87306 619.597486     192.168.3.103         34.49.233.224         TCP      54     [TCP Keep-Alive ACK] 54396 → 443 [ACK] Seq=2504 Ack=6828 Win=130048 Len=0

Frame 87306: 54 bytes on wire (432 bits), 54 bytes captured (432 bits) on interface \Device\NPF_{FF4772B8-9159-442F-8EE1-63F8B1A5EF2A}, id 0
Ethernet II, Src: Intel_25:d9:6f (c8:f7:33:25:d9:6f), Dst: TendaTechnol_8d:1d:b0 (58:d9:d5:8d:1d:b0)
Internet Protocol Version 4, Src: 192.168.3.103, Dst: 34.49.233.224
Transmission Control Protocol, Src Port: 54396, Dst Port: 443, Seq: 2504, Ack: 6828, Len: 0

No.     Time           Source                Destination           Protocol Length Info
  87562 634.138703     192.168.3.103         34.49.233.224         TCP      55     [TCP Keep-Alive] 54396 → 443 [ACK] Seq=2503 Ack=6828 Win=130048 Len=1

Frame 87562: 55 bytes on wire (440 bits), 55 bytes captured (440 bits) on interface \Device\NPF_{FF4772B8-9159-442F-8EE1-63F8B1A5EF2A}, id 0
Ethernet II, Src: Intel_25:d9:6f (c8:f7:33:25:d9:6f), Dst: TendaTechnol_8d:1d:b0 (58:d9:d5:8d:1d:b0)
Internet Protocol Version 4, Src: 192.168.3.103, Dst: 34.49.233.224
Transmission Control Protocol, Src Port: 54396, Dst Port: 443, Seq: 2503, Ack: 6828, Len: 1
Data (1 byte)

0000  00                                                .

No.     Time           Source                Destination           Protocol Length Info
  87564 634.156313     34.49.233.224         192.168.3.103         TCP      66     [TCP Keep-Alive ACK] 443 → 54396 [ACK] Seq=6828 Ack=2504 Win=267776 Len=0 SLE=2503 SRE=2504

Frame 87564: 66 bytes on wire (528 bits), 66 bytes captured (528 bits) on interface \Device\NPF_{FF4772B8-9159-442F-8EE1-63F8B1A5EF2A}, id 0
Ethernet II, Src: TendaTechnol_8d:1d:b0 (58:d9:d5:8d:1d:b0), Dst: Intel_25:d9:6f (c8:f7:33:25:d9:6f)
Internet Protocol Version 4, Src: 34.49.233.224, Dst: 192.168.3.103
Transmission Control Protocol, Src Port: 443, Dst Port: 54396, Seq: 6828, Ack: 2504, Len: 0

No.     Time           Source                Destination           Protocol Length Info
  93878 664.596496     34.49.233.224         192.168.3.103         TCP      54     [TCP Keep-Alive] 443 → 54396 [ACK] Seq=6827 Ack=2504 Win=267776 Len=0

Frame 93878: 54 bytes on wire (432 bits), 54 bytes captured (432 bits) on interface \Device\NPF_{FF4772B8-9159-442F-8EE1-63F8B1A5EF2A}, id 0
Ethernet II, Src: TendaTechnol_8d:1d:b0 (58:d9:d5:8d:1d:b0), Dst: Intel_25:d9:6f (c8:f7:33:25:d9:6f)
Internet Protocol Version 4, Src: 34.49.233.224, Dst: 192.168.3.103
Transmission Control Protocol, Src Port: 443, Dst Port: 54396, Seq: 6827, Ack: 2504, Len: 0

No.     Time           Source                Destination           Protocol Length Info
  93879 664.596624     192.168.3.103         34.49.233.224         TCP      54     [TCP Keep-Alive ACK] 54396 → 443 [ACK] Seq=2504 Ack=6828 Win=130048 Len=0

Frame 93879: 54 bytes on wire (432 bits), 54 bytes captured (432 bits) on interface \Device\NPF_{FF4772B8-9159-442F-8EE1-63F8B1A5EF2A}, id 0
Ethernet II, Src: Intel_25:d9:6f (c8:f7:33:25:d9:6f), Dst: TendaTechnol_8d:1d:b0 (58:d9:d5:8d:1d:b0)
Internet Protocol Version 4, Src: 192.168.3.103, Dst: 34.49.233.224
Transmission Control Protocol, Src Port: 54396, Dst Port: 443, Seq: 2504, Ack: 6828, Len: 0

No.     Time           Source                Destination           Protocol Length Info
  93981 679.157087     192.168.3.103         34.49.233.224         TCP      55     [TCP Keep-Alive] 54396 → 443 [ACK] Seq=2503 Ack=6828 Win=130048 Len=1

Frame 93981: 55 bytes on wire (440 bits), 55 bytes captured (440 bits) on interface \Device\NPF_{FF4772B8-9159-442F-8EE1-63F8B1A5EF2A}, id 0
Ethernet II, Src: Intel_25:d9:6f (c8:f7:33:25:d9:6f), Dst: TendaTechnol_8d:1d:b0 (58:d9:d5:8d:1d:b0)
Internet Protocol Version 4, Src: 192.168.3.103, Dst: 34.49.233.224
Transmission Control Protocol, Src Port: 54396, Dst Port: 443, Seq: 2503, Ack: 6828, Len: 1
Data (1 byte)

0000  00                                                .

No.     Time           Source                Destination           Protocol Length Info
  93982 679.175678     34.49.233.224         192.168.3.103         TCP      66     [TCP Keep-Alive ACK] 443 → 54396 [ACK] Seq=6828 Ack=2504 Win=267776 Len=0 SLE=2503 SRE=2504

Frame 93982: 66 bytes on wire (528 bits), 66 bytes captured (528 bits) on interface \Device\NPF_{FF4772B8-9159-442F-8EE1-63F8B1A5EF2A}, id 0
Ethernet II, Src: TendaTechnol_8d:1d:b0 (58:d9:d5:8d:1d:b0), Dst: Intel_25:d9:6f (c8:f7:33:25:d9:6f)
Internet Protocol Version 4, Src: 34.49.233.224, Dst: 192.168.3.103
Transmission Control Protocol, Src Port: 443, Dst Port: 54396, Seq: 6828, Ack: 2504, Len: 0

No.     Time           Source                Destination           Protocol Length Info
  99685 709.595491     34.49.233.224         192.168.3.103         TCP      54     [TCP Keep-Alive] 443 → 54396 [ACK] Seq=6827 Ack=2504 Win=267776 Len=0

Frame 99685: 54 bytes on wire (432 bits), 54 bytes captured (432 bits) on interface \Device\NPF_{FF4772B8-9159-442F-8EE1-63F8B1A5EF2A}, id 0
Ethernet II, Src: TendaTechnol_8d:1d:b0 (58:d9:d5:8d:1d:b0), Dst: Intel_25:d9:6f (c8:f7:33:25:d9:6f)
Internet Protocol Version 4, Src: 34.49.233.224, Dst: 192.168.3.103
Transmission Control Protocol, Src Port: 443, Dst Port: 54396, Seq: 6827, Ack: 2504, Len: 0

No.     Time           Source                Destination           Protocol Length Info
  99686 709.595642     192.168.3.103         34.49.233.224         TCP      54     [TCP Keep-Alive ACK] 54396 → 443 [ACK] Seq=2504 Ack=6828 Win=130048 Len=0

Frame 99686: 54 bytes on wire (432 bits), 54 bytes captured (432 bits) on interface \Device\NPF_{FF4772B8-9159-442F-8EE1-63F8B1A5EF2A}, id 0
Ethernet II, Src: Intel_25:d9:6f (c8:f7:33:25:d9:6f), Dst: TendaTechnol_8d:1d:b0 (58:d9:d5:8d:1d:b0)
Internet Protocol Version 4, Src: 192.168.3.103, Dst: 34.49.233.224
Transmission Control Protocol, Src Port: 54396, Dst Port: 443, Seq: 2504, Ack: 6828, Len: 0

No.     Time           Source                Destination           Protocol Length Info
  99941 724.178982     192.168.3.103         34.49.233.224         TCP      55     [TCP Keep-Alive] 54396 → 443 [ACK] Seq=2503 Ack=6828 Win=130048 Len=1

Frame 99941: 55 bytes on wire (440 bits), 55 bytes captured (440 bits) on interface \Device\NPF_{FF4772B8-9159-442F-8EE1-63F8B1A5EF2A}, id 0
Ethernet II, Src: Intel_25:d9:6f (c8:f7:33:25:d9:6f), Dst: TendaTechnol_8d:1d:b0 (58:d9:d5:8d:1d:b0)
Internet Protocol Version 4, Src: 192.168.3.103, Dst: 34.49.233.224
Transmission Control Protocol, Src Port: 54396, Dst Port: 443, Seq: 2503, Ack: 6828, Len: 1
Data (1 byte)

0000  00                                                .

No.     Time           Source                Destination           Protocol Length Info
  99942 724.194692     34.49.233.224         192.168.3.103         TCP      66     [TCP Keep-Alive ACK] 443 → 54396 [ACK] Seq=6828 Ack=2504 Win=267776 Len=0 SLE=2503 SRE=2504

Frame 99942: 66 bytes on wire (528 bits), 66 bytes captured (528 bits) on interface \Device\NPF_{FF4772B8-9159-442F-8EE1-63F8B1A5EF2A}, id 0
Ethernet II, Src: TendaTechnol_8d:1d:b0 (58:d9:d5:8d:1d:b0), Dst: Intel_25:d9:6f (c8:f7:33:25:d9:6f)
Internet Protocol Version 4, Src: 34.49.233.224, Dst: 192.168.3.103
Transmission Control Protocol, Src Port: 443, Dst Port: 54396, Seq: 6828, Ack: 2504, Len: 0

No.     Time           Source                Destination           Protocol Length Info
 100189 754.595776     34.49.233.224         192.168.3.103         TCP      54     [TCP Keep-Alive] 443 → 54396 [ACK] Seq=6827 Ack=2504 Win=267776 Len=0

Frame 100189: 54 bytes on wire (432 bits), 54 bytes captured (432 bits) on interface \Device\NPF_{FF4772B8-9159-442F-8EE1-63F8B1A5EF2A}, id 0
Ethernet II, Src: TendaTechnol_8d:1d:b0 (58:d9:d5:8d:1d:b0), Dst: Intel_25:d9:6f (c8:f7:33:25:d9:6f)
Internet Protocol Version 4, Src: 34.49.233.224, Dst: 192.168.3.103
Transmission Control Protocol, Src Port: 443, Dst Port: 54396, Seq: 6827, Ack: 2504, Len: 0

No.     Time           Source                Destination           Protocol Length Info
 100190 754.595925     192.168.3.103         34.49.233.224         TCP      54     [TCP Keep-Alive ACK] 54396 → 443 [ACK] Seq=2504 Ack=6828 Win=130048 Len=0

Frame 100190: 54 bytes on wire (432 bits), 54 bytes captured (432 bits) on interface \Device\NPF_{FF4772B8-9159-442F-8EE1-63F8B1A5EF2A}, id 0
Ethernet II, Src: Intel_25:d9:6f (c8:f7:33:25:d9:6f), Dst: TendaTechnol_8d:1d:b0 (58:d9:d5:8d:1d:b0)
Internet Protocol Version 4, Src: 192.168.3.103, Dst: 34.49.233.224
Transmission Control Protocol, Src Port: 54396, Dst Port: 443, Seq: 2504, Ack: 6828, Len: 0

No.     Time           Source                Destination           Protocol Length Info
 100269 769.198212     192.168.3.103         34.49.233.224         TCP      55     [TCP Keep-Alive] 54396 → 443 [ACK] Seq=2503 Ack=6828 Win=130048 Len=1

Frame 100269: 55 bytes on wire (440 bits), 55 bytes captured (440 bits) on interface \Device\NPF_{FF4772B8-9159-442F-8EE1-63F8B1A5EF2A}, id 0
Ethernet II, Src: Intel_25:d9:6f (c8:f7:33:25:d9:6f), Dst: TendaTechnol_8d:1d:b0 (58:d9:d5:8d:1d:b0)
Internet Protocol Version 4, Src: 192.168.3.103, Dst: 34.49.233.224
Transmission Control Protocol, Src Port: 54396, Dst Port: 443, Seq: 2503, Ack: 6828, Len: 1
Data (1 byte)

0000  00                                                .

No.     Time           Source                Destination           Protocol Length Info
 100272 769.214750     34.49.233.224         192.168.3.103         TCP      66     [TCP Keep-Alive ACK] 443 → 54396 [ACK] Seq=6828 Ack=2504 Win=267776 Len=0 SLE=2503 SRE=2504

Frame 100272: 66 bytes on wire (528 bits), 66 bytes captured (528 bits) on interface \Device\NPF_{FF4772B8-9159-442F-8EE1-63F8B1A5EF2A}, id 0
Ethernet II, Src: TendaTechnol_8d:1d:b0 (58:d9:d5:8d:1d:b0), Dst: Intel_25:d9:6f (c8:f7:33:25:d9:6f)
Internet Protocol Version 4, Src: 34.49.233.224, Dst: 192.168.3.103
Transmission Control Protocol, Src Port: 443, Dst Port: 54396, Seq: 6828, Ack: 2504, Len: 0

No.     Time           Source                Destination           Protocol Length Info
 100544 799.594076     34.49.233.224         192.168.3.103         TCP      54     [TCP Keep-Alive] 443 → 54396 [ACK] Seq=6827 Ack=2504 Win=267776 Len=0

Frame 100544: 54 bytes on wire (432 bits), 54 bytes captured (432 bits) on interface \Device\NPF_{FF4772B8-9159-442F-8EE1-63F8B1A5EF2A}, id 0
Ethernet II, Src: TendaTechnol_8d:1d:b0 (58:d9:d5:8d:1d:b0), Dst: Intel_25:d9:6f (c8:f7:33:25:d9:6f)
Internet Protocol Version 4, Src: 34.49.233.224, Dst: 192.168.3.103
Transmission Control Protocol, Src Port: 443, Dst Port: 54396, Seq: 6827, Ack: 2504, Len: 0

No.     Time           Source                Destination           Protocol Length Info
 100545 799.594141     192.168.3.103         34.49.233.224         TCP      54     [TCP Keep-Alive ACK] 54396 → 443 [ACK] Seq=2504 Ack=6828 Win=130048 Len=0

Frame 100545: 54 bytes on wire (432 bits), 54 bytes captured (432 bits) on interface \Device\NPF_{FF4772B8-9159-442F-8EE1-63F8B1A5EF2A}, id 0
Ethernet II, Src: Intel_25:d9:6f (c8:f7:33:25:d9:6f), Dst: TendaTechnol_8d:1d:b0 (58:d9:d5:8d:1d:b0)
Internet Protocol Version 4, Src: 192.168.3.103, Dst: 34.49.233.224
Transmission Control Protocol, Src Port: 54396, Dst Port: 443, Seq: 2504, Ack: 6828, Len: 0

No.     Time           Source                Destination           Protocol Length Info
 100601 814.225230     192.168.3.103         34.49.233.224         TCP      55     [TCP Keep-Alive] 54396 → 443 [ACK] Seq=2503 Ack=6828 Win=130048 Len=1

Frame 100601: 55 bytes on wire (440 bits), 55 bytes captured (440 bits) on interface \Device\NPF_{FF4772B8-9159-442F-8EE1-63F8B1A5EF2A}, id 0
Ethernet II, Src: Intel_25:d9:6f (c8:f7:33:25:d9:6f), Dst: TendaTechnol_8d:1d:b0 (58:d9:d5:8d:1d:b0)
Internet Protocol Version 4, Src: 192.168.3.103, Dst: 34.49.233.224
Transmission Control Protocol, Src Port: 54396, Dst Port: 443, Seq: 2503, Ack: 6828, Len: 1
Data (1 byte)

0000  00                                                .

No.     Time           Source                Destination           Protocol Length Info
 100602 814.250316     34.49.233.224         192.168.3.103         TCP      66     [TCP Keep-Alive ACK] 443 → 54396 [ACK] Seq=6828 Ack=2504 Win=267776 Len=0 SLE=2503 SRE=2504

Frame 100602: 66 bytes on wire (528 bits), 66 bytes captured (528 bits) on interface \Device\NPF_{FF4772B8-9159-442F-8EE1-63F8B1A5EF2A}, id 0
Ethernet II, Src: TendaTechnol_8d:1d:b0 (58:d9:d5:8d:1d:b0), Dst: Intel_25:d9:6f (c8:f7:33:25:d9:6f)
Internet Protocol Version 4, Src: 34.49.233.224, Dst: 192.168.3.103
Transmission Control Protocol, Src Port: 443, Dst Port: 54396, Seq: 6828, Ack: 2504, Len: 0
